"Grid_Value","RUBL_LC","Area","Area_Name","Comb_Value","NVCMES","Level3","ClassName","Description.of.Ecological.System.or.Land.use.class","X"
281,"floodplain_forest",1,"CONUS",281,"01.C.3.D013M036E281",9856,"North American Warm Desert Riparian Systems","This desert riparian systems group occurs along drainages and intermittently flooded basins in the northern Chihuahuan and Sonoran deserts, and extends into limited areas of the southern Great Plains and Edwards Plateau and up into the lower montane zone of Sky Island mountains. The woody riparian stands occur in mountain canyons and valleys of southern Arizona, New Mexico, western Texas and adjacent Mexico, and consist of mid- to low-elevation (1100-1800 m) riparian corridors along perennial and seasonally intermittent streams. The intermittently flooded basins are relatively small depressions on broad mesas, plains and valley bottoms that receive runoff from adjacent areas. The riparian vegetation is a mix of riparian woodlands and shrublands. Characteristic woody species include Acer negundo, Alnus oblongifolia, Baccharis salicifolia, Celtis laevigata var. reticulata, Fraxinus velutina, Juglans major, Platanus wrightii, Pluchea sericea, Populus angustifolia, Populus deltoides ssp. wislizeni, Populus fremontii, Prosopis glandulosa, Prosopis velutina, Prunus spp., Salix exigua, Salix lasiolepis, Salix geyeriana, Salix gooddingii, Sapindus saponaria, and Shepherdia argentea. These systems may have inclusions of herbaceous-dominated vegetation, typically Pleuraphis mutica, Pascopyrum smithii, Panicum obtusum, Sporobolus airoides, or Sporobolus wrightii.","."
282,"floodplain_forest",1,"CONUS",282,"01.C.3.D013M036E282",9835,"North American Warm Desert Riparian Woodland and Shrubland","These woodlands and shrublands occur along lower elevation rivers and streams in desert valleys and canyons in the southwestern US.  Common trees include box-elder, velvet ash, Fremont cottonwood, Goodding's willow, arroyo willow, netleaf hackberry, and Arizona walnut. The shrublands are often composed of Geyer's willow, silver buffaloberry, and coyote willow.","."
283,"floodplain_forest",1,"CONUS",283,"01.C.3.D013M036E283",9816,"Tamaulipan Floodplain","This ecological system is limited to riparian areas of the lower Rio Grande Valley and Rio Corona in southern Texas and northeastern Mexico. Stands occur on riverbanks, floodplains and deltas. These woodlands are a unique mix of species from southeastern North America and subtropical Central America and often dominated by sweet acacia, shagbark hickory, sugarberry, Texas persimmon, Texas ebony, knockaway, Rio Grande ash, eastern cottonwood, or cedar elm, and many other tree species present to locally dominant, with pecan, black hickory, post oak, and plateau live oak more common in the northern extent. The highly variable understory is dependent on canopy density and may include dense shrub or herbaceous layers.","."
284,"floodplain_forest",1,"CONUS",284,"01.C.3.D013M036E284",9821,"Tamaulipan Riparian Systems","This Tamaulipan riparian systems group occurs along the lower Rio Grande and Rio Corona in southern Texas and northeastern Mexico. Palm grove riparian forests and woodlands are found on riverbanks and floodplains, while arroyo shrublands are restricted to drainages in upland areas or ramaderos that are only intermittently flooded and often dry. Soils are typically somewhat deeper than those of the surrounding landscape. Palm grove characteristic species are the neotropical Sabal mexicana with Ebenopsis ebano, Ehretia anacua, Leucaena pulverulenta, and many other riparian plants. In the shrublands, the dense shrub canopy is a mix of species often including Acacia farnesiana, Celtis pallida, Haematoxylum brasiletto, Prosopis glandulosa, or Tecoma stans.","."
289,"floodplain_forest",1,"CONUS",289,"01.D.2.D016M300E289",9815,"Eastern Boreal Floodplain","These southern boreal floodplains are found in the extreme northern portions of the eastern U.S., and believed to be more widespread in Canada. They consist of flat floodplains along northern rivers, in depositional areas not strongly influenced by ice-scour, where topography and process have resulted in a complex of upland and wetland alluvial vegetation. This complex includes floodplain forests dominated by northern trees such as balsam poplar and black ash, as well as herbaceous sloughs and shrub wetlands. (Silver maple is uncommon or absent.) Most areas are underwater each spring; microtopography determines how long the various habitats are inundated. The distribution in the U.S. appears to be primarily Canadian, with incursions into northern Maine and northern Minnesota.","."
511,"floodplain_forest",1,"CONUS",511,"05.B.1.D049M108E511",9808,"South-Central Interior Large Floodplain - Herbaceous Modifier","This floodplain system is found throughout the Interior low Plateau, Cumberlands, Southern Ridge and Valley, Western Allegheny Plateau, and lower elevations of the Southern Blue Ridge.  Examples occur along large rivers where topography and alluvial processes have resulted in a well-developed floodplain.  A single occurrence may extend from river's edge across the outermost extent of the floodplain or to where it meets a wet meadow or upland system.  Many examples of this system will contain well-drained levees, terraces and stabilized bars, and some will include herbaceous sloughs and shrub wetlands resulting, in part, from beaver activity.  A variety of soil types may be found within the floodplain from very well-drained sandy substrates to very dense clays.  It is this variety of substrates in combination with different flooding regimes that creates the mix of vegetation.  Most areas, except for the montane alluvial forests, are inundated at some point each spring; microtopography determines how long the various habitats are inundated.  Although vegetation is quite variable in this broadly defined system, examples may include Acer saccharinum, Platanus occidentalis, Liquidambar styraciflua, and Quercus spp.  Understory species are mixed, but include shrubs, such as Cephalanthus occidentalis and Arundinaria gigantea ssp. gigantea, and sedges (Carex spp.).  This system likely floods at least once annually and can be altered by occasional severe floods.  Impoundments and conversion to agriculture can also impact this system.

Variation:  Herbaceous - Herbaceous sloughs and shrub wetlands (canebrakes, sedges, and buttonbush) that occur within the floodplain.

Other Variation(s):  Forested.","."
512,"floodplain_forest",1,"CONUS",512,"05.B.1.D049M108E512",9807,"East Gulf Coastal Plain Large River Floodplain Forest - Herbaceous Modifier","This system represents a geographic subset of Kuchler's (1964) Southern Floodplain Forest.  Examples may be found along large rivers of the East and Upper East Gulf Coastal Plain, especially the Apalachicola, Alabama, Tombigbee, Pascagoula, and Pearl rivers, all of which ultimately drain into the Gulf of Mexico.  Several distinct plant communities can be recognized within this system that may be related to the array of different geomorphologic features present within the floodplain.  Some of the major geomorphic features associated with different community types include natural levees, point bars, meander scrolls, oxbows, and sloughs (Sharitz and Mitsch 1993).  Vegetation generally includes forests dominated by bottomland hardwood species and other trees tolerant of flooding.  However, herbaceous and shrub vegetation may be present in certain areas as well.

Variation:  Herbaceous - Areas dominated by wetland herbaceous or shrubs (buttonbush, swamp-loosestrife, swamp private).

Other Variation(s):  Forested.","."
