"Grid_Value","RUBL_LC","Area","Area_Name","Comb_Value","NVCMES","Level3","ClassName","Description.of.Ecological.System.or.Land.use.class","X"
219,"floodplain_forest",1,"CONUS",219,"01.C.3.D062M031E219",9804,"East Gulf Coastal Plain Large River Floodplain Forest - Forest Modifier","This system represents a geographic subset of Kuchler's (1964) Southern Floodplain Forest.  Examples may be found along large rivers of the East and Upper East Gulf Coastal Plain, especially the Apalachicola, Alabama, Tombigbee, Pascagoula, and Pearl rivers, all of which ultimately drain into the Gulf of Mexico.  Several distinct plant communities can be recognized within this system that may be related to the array of different geomorphologic features present within the floodplain.  Some of the major geomorphic features associated with different community types include natural levees, point bars, meander scrolls, oxbows, and sloughs (Sharitz and Mitsch 1993).  Vegetation generally includes forests dominated by bottomland hardwood species and other trees tolerant of flooding.  However, herbaceous and shrub vegetation may be present in certain areas as well.

Variation:  Forested - Forest canopy present.

Other Variation(s):  Herbaceous.","."
220,"floodplain_forest",1,"CONUS",220,"01.C.3.D062M031E220",9851,"East Gulf Coastal Plain Small Stream and River Floodplain Forest","This is a predominantly forested system of the East Gulf Coastal Plain associated with small brownwater rivers and creeks. In contrast to ~East Gulf Coastal Plain Large River Floodplain Forest (CES203.489)$$, it has fewer major geomorphic floodplain features typically associated with large river floodplains. Those features that are present tend to be smaller and more closely intermixed with one another, resulting in less obvious vegetational zonation. Bottomland hardwood tree species are typically important and diagnostic, although mesic hardwood species are also present in areas with less inundation, such as upper terraces and possibly second bottoms. As a whole, flooding occurs annually, but the water table usually is well below the soil surface throughout most of the growing season. Areas impacted by beaver impoundments are also included in this system.","."
221,"floodplain_forest",1,"CONUS",221,"01.C.3.D062M031E221",9210,"East Gulf Coastal Plain Tidal Wooded Swamp","This system encompasses the tidally flooded portions of river floodplains which flow into the northern Gulf of Mexico east of the Mississippi River. Large outflows of freshwater keep salinity levels at a minimum, and flooding is of short enough duration to allow survival of tree canopies. Bald cypress, tupelo, or ash generally dominate. These swamps may be regularly flooded at least twice daily (FNAI 1990).","."
222,"floodplain_forest",1,"CONUS",222,"01.C.3.D062M031E222",4142,"East-Central Texas Plains Floodplain Forest","This system is found in the floodplains of medium and large rivers of the ""East Central Texas Plains"" (sensu EPA; Griffith et al. (2004) Level III Ecoregion 33) and ""Texas Blackland Prairie"" (Level III Ecoregion 32), this comprising the terrain between the West Gulf Coastal Plain (or South Central Plains; Level III Ecoregion 35 sensu EPA) to the east and the Crosstimbers (EPA level III Ecoregion 27) and Edwards Plateau (EPA level III Ecoregion 30 etc.) to the west. Alluvial soils and sedimentation processes typify this system. Periodic, intermediate flooding and deposition (every 5-25 years) dominates the formation and maintenance of this system. Dominant communities within this system range from floodplain forests to wet meadows to gravel/sand flats; however, they are linked by underlying soils and the flooding regime. Canopy dominants may include pecan, cedar elm, American elm, sugarberry, plateau live oak, water oak, white ash, sycamore, box-elder, Arizona walnut, bur oak, red mulberry, green ash, and western soapberry. Overgrazing and/or overbrowsing may influence recruitment of overstory species and composition of the understory and herbaceous layers. Shrub species may include beautyberry, possum-haw, gum bumelia, eastern persimmon, farkleberry, eastern red-cedar, roughleaf dogwood, and rusty blackhaw, which may occur as dense patches following disturbance, but are otherwise generally fairly sparse. Herbaceous cover includes Virginia wild rye, common frostweed, river-oats, longleaf wood-oats, eastern gammagrass, Drummond's aster, white avens, Canadian black snakeroot, switchgrass, bedstraw spp., and sedge sp. Herbaceous cover may be quite high, especially in situations where shrub cover is low. The environment and vegetation of this system become generally and correspondingly drier from east to west with moister representatives (such as communities containing willow oak, cherrybark oak, white oak, and overcup oak ) occurring along the eastern and northeastern margins of the range. Representatives of this system may vary in the openness of the habitat and physiognomy.","."
223,"floodplain_forest",1,"CONUS",223,"01.C.3.D062M031E223",4141,"East-Central Texas Plains Riparian Forest","This system occurs in various situations along small and intermittent streams of the ""East Central Texas Plains"" (sensu EPA; Griffith et al. (2004) Level III Ecoregion 33) and ""Texas Blackland Prairie"" (Level III Ecoregion 32), this comprising the terrain between the West Gulf Coastal Plain (or South Central Plains; Level III Ecoregion 35 sensu EPA) to the east and the Crosstimbers (EPA level III Ecoregion 27 and Edwards Plateau (EPA level III Ecoregion 30 etc. to the west). Some trees that may be present in stands of this system include sugarberry, netleaf hackberry, sycamore, little walnut, Arizona walnut, plateau live oak, water oak, willow oak, tall indigobush, swamp privet, silver maple, wingleaf soapberry, black willow, green ash, honey-locust, pecan, and cedar elm. The environment and vegetation of this system become generally and correspondingly drier from east to west with moister representatives (such as communities containing water oak) occurring in the eastern parts of the range. Representatives of this system typically occur in stream-scoured situations and vary in the openness of the habitat and physiognomy.","."
224,"floodplain_forest",1,"CONUS",224,"01.C.3.D062M031E224",9817,"Eastern Great Plains Floodplain Systems","This system is found along rivers across the glaciated Midwest. It occurs from river's edge across the floodplain or to where it meets a wet meadow system. It can have a variety of soil types found within the floodplain from very well-drained sandy substrates to very dense clays. It is this variety of substrates and flooding that creates the mix of vegetation that includes Acer saccharinum, Populus deltoides, willows, especially Salix nigra in the wettest areas, and Fraxinus pennsylvanica, Ulmus americana, and Quercus macrocarpa in more well-drained areas. Within this system are oxbows that may support Nelumbo lutea and Typha latifolia. Understory species are mixed, but include shrubs, such as Cornus drummondii and Asimina triloba (in Kansas), sedges and grasses, which sometimes help form savanna vegetation. Flooding is the primary dynamic process, but drought, grazing, and fire have all had historical influence on this system. Federal reservoirs have had a serious and negative effect on this system, along with agriculture that has converted much of this system to drained agricultural land.","."
225,"floodplain_forest",1,"CONUS",225,"01.C.3.D062M031E225",9717,"Mississippi River Bottomland Depression","This system represents semipermanently flooded to saturated depressional areas of the lower Mississippi River Alluvial Valley, from southern Illinois south to Mississippi and Louisiana. These areas have a distinctly longer hydroperiod than other parts of the landscape. Typical and characteristic trees in examples of this system include swamp red maple, water hickory, pumpkin ash, water-locust, water tupelo, swamp blackgum, planertree, overcup oak, pin oak, black willow, and bald-cypress. Some characteristic shrubs include common buttonbush, stiff dogwood, swamp-loosestrife, swamp privet, Virginia-willow, and planertree. Herbs are uncommon, but floating water-primrose, lanceleaf arrowhead, hornwort spp., waterweed spp., pondweed spp., and lesser duckweed may be found.","."
226,"floodplain_forest",1,"CONUS",226,"01.C.3.D062M031E226",9854,"Mississippi River Floodplain and Riparian Forest","This systems group comprises floodplain forests in the Mississippi River Alluvial Plain of the southeastern United States, from far southeastern Missouri and extreme southern Illinois south to the Gulf of Mexico, including the floodplains and terraces of the Mississippi River and the Red River (in Louisiana and eastern Texas). Within this area, it includes broad gradients of river size, soil nutrient levels, and flood frequency, including smaller tributaries. Flooding ranges from semipermanent in the wettest areas to intermittent and short on the higher portions of the floodplain. Some of the major geomorphic features associated with different community types include natural levees, point bars, meander scrolls, oxbows, and sloughs. Small river floodplain forests have fewer major geomorphic floodplain features typically associated with large river floodplains. Those features that are present tend to be smaller and more closely intermixed with one another, resulting in less obvious vegetational zonation. Large rivers have greater variation in water levels and have flood regimes that integrate the effects of very large watersheds. Depositional landforms are larger, and communities can be more segregated. Along the Mississippi River, low bottomlands are characteristic. These are seasonally flooded backswamps, with flooding usually more frequent than every two years, generally by still water that may be impounded behind natural levees. Vegetation generally includes forests dominated by bottomland hardwood species and other trees tolerant of flooding. However, herbaceous and shrub vegetation may be present in certain areas, particularly on recently deposited bars and in oxbow lakes. Most examples are nearly contiguous over large areas, broken only by the river itself. Higher terraces may have a mosaic of floodplain and upland systems, and may include nonriverine wetland systems. Some of the most typical and characteristic tree species found in stands of this systems group include Taxodium distichum, Nyssa aquatica, Acer saccharinum, Platanus occidentalis, Populus deltoides, Acer negundo, and Salix nigra. Other trees may include Celtis laevigata, Carya illinoinensis, Fraxinus pennsylvanica, Gleditsia triacanthos, Liquidambar styraciflua, Nyssa biflora, Quercus laurifolia, Quercus lyrata, Quercus michauxii, Quercus nigra, Quercus pagoda, Quercus phellos, Quercus similis, Quercus texana, Quercus virginiana, Salix nigra, Ulmus americana, and Ulmus crassifolia. Three distinct groups of associations can be recognized. The lowest, wettest areas have some combination of Taxodium distichum and Nyssa aquatica dominating. Natural levees and riverfronts have a diverse mixture of trees that typically includes Platanus occidentalis, Celtis laevigata, Fraxinus pennsylvanica, Acer saccharinum, Acer negundo, and other species that benefit from the high light levels and heavy alluvial deposition of these sites. Soils are typically sandier than those of the lower bottomlands. Arundinaria gigantea (giant cane) is a common understory in these forests on natural levees and higher point bars, and may become dominant after thinning or removal of the overstory. Willow and cottonwood sandbars may have an open-canopy (woodland-type) structure. Moderate to high parts of the floodplain away from the levee are usually dominated by bottomland hardwoods, various mixtures of wetland oaks, including Quercus laurifolia, Quercus michauxii, Quercus pagoda, and sometimes a number of other oak species, along with Liquidambar styraciflua or other species. The wettest forests can be simple in structure, with an understory but little shrub or herb layer; others tend to have well-developed subcanopy, shrub, and herb layers. Woody vines are usually prominent. Shrubs and small trees include Alnus serrulata, Arundinaria gigantea, Carpinus caroliniana, Cephalanthus occidentalis, Clethra alnifolia, Cornus foemina, Crataegus viridis, Forestiera acuminata, Ilex decidua, Itea virginica, Morella cerifera, Planera aquatica, Sabal minor, and Sebastiania fruticosa. Vines may include Berchemia scandens and Smilax bona-nox. Herbaceous species may include Boehmeria cylindrica, Carex complanata, Carex debilis, Carex intumescens, Carex joorii, Leersia virginica, Lycopus virginicus, Mikania scandens, Saccharum baldwinii, and Typha latifolia. Aquatic and floating herbs include Lemna minor, Nelumbo lutea, Nuphar lutea ssp. advena, and Nymphaea odorata.","."
227,"floodplain_forest",1,"CONUS",227,"01.C.3.D062M031E227",9836,"Mississippi River Low Floodplain (Bottomland) Forest","Low bottomlands are usually seasonally flooded in backswamps, with flooding more frequent than every five years, usually more frequently than every two years, generally by still water that may be impounded behind natural levees, and are classed as Low Gradient Riverine Backwater wetlands in hydrogeomorphic classifications. Low bottomlands occur along the Mississippi River and its tributaries in the Mississippi River Alluvial Plain ecoregion. Prolonged flooding dominates this system, and its duration is greater that in the adjacent Mississippi River Riparian Forest. Overcup oak is the characteristic dominant species. Soils are clayey with poor internal drainage.","."
228,"floodplain_forest",1,"CONUS",228,"01.C.3.D062M031E228",9827,"Mississippi River Riparian Forest","This system is comprised of ""riverfront"" Associations, generally temporarily (but rarely seasonally) flooded on point bars and natural levees adjacent to the river that formed them, with flooding more frequent than every five years, by flowing water directly from the stream. They occur along the lower Mississippi River and its tributaries in the Mississippi River Alluvial Plain ecoregion. They are classed as Low Gradient Riverine Overbank wetlands in a hydrogeomorphic classification. Flooding is of lower duration than on adjacent backswamps where water is impounded behind riverfront natural levees. Flooding is of longer duration than on adjacent high bottomlands that are typically temporarily flooded. Soils are typically sandier than those of low bottomlands. Giant cane (giant cane) is a common understory in these forests on natural levees and higher point bars, and may become dominant after thinning or removal of overstory. Willow and cottonwood sandbars may have an open-canopy (woodland-type) structure.","."
229,"floodplain_forest",1,"CONUS",229,"01.C.3.D062M031E229",9844,"Red River Large Floodplain Forest","This system represents a geographic subset of Kuchler's (1964) Southern Floodplain Forest which is specifically restricted to the main stem of the Red River in southwestern Arkansas (partly bordering Texas) and Louisiana in the West Gulf Coastal Plain and Upper West Gulf Coastal Plain. Several distinct plant communities can be recognized within this system that may be related to the array of different geomorphic features present within the floodplain. Some of the major geomorphic features associated with different community types within the system include natural levees, point bars, meander scrolls, oxbows, and sloughs (Sharitz and Mitsch 1993). Vegetation generally includes forests dominated by bottomland hardwood species and other trees tolerant of flooding, including bald-cypress and water tupelo. However, herbaceous and shrub vegetation may be present in certain areas as well. This system is generally similar in concept to ~West Gulf Coastal Plain Large River Floodplain Forest (CES203.488)$$ but is distinct from it because of the difference in magnitude between the typical large rivers (such as the Trinity, Neches, and Sabine), on the one hand, and the Mississippi River on the other. Its range is conceptually coincident with the vast majority of Subsection 234Ai of Keys et al. (1995), excluding the portion of 234Ai within TNC Ecoregion 42 (Mississippi River Alluvial Plain). Its range is also coincident with Level IV Ecoregion 35g (red River Bottomlands) of Omernik.","."
230,"floodplain_forest",1,"CONUS",230,"01.C.3.D062M031E230",9852,"Southern Coastal Plain Blackwater River Floodplain Forest","This system occurs along certain river and stream drainages of the southern Coastal Plain of Florida, Alabama, Mississippi, and southwestern Georgia that are characterized by dark waters high in particulate and dissolved organic materials, and that generally lack floodplain development. In most cases these are streams that have their headwaters in sandy portions of the Outer Coastal Plain. Consequently, they carry little mineral sediment or suspended clay particles and are not turbid except after the heaviest rain events. The water is classically dark in color due to concentrations of tannins, particulates, and other materials derived from drainage through swamps or marshes (FNAI 1990). In comparison with spring-fed rivers and brownwater rivers of the region, this system tends to be much more acidic in nature and generally lacks extensive and continuous floodplain and levees; steep banks alternating with floodplain swamps are more characteristic (FNAI 1990). This system includes mixed rivers, with a mixture of blackwater and spring-fed tributaries such as the Suwannee River. Canopy species typical of this system are obligate to facultative wetland species such as bald-cypress (bald-cypress), water tupelo (water tupelo), and Atlantic white-cedar (Atlantic white-cedar).","."
231,"floodplain_forest",1,"CONUS",231,"01.C.3.D062M031E231",9806,"Southern Piedmont Large Floodplain Forest - Forest Modifier","This system consists of vegetated communities along Piedmont rivers, south of the James River in Virginia, where flooding and flood-related environmental factors affect vegetational composition and dynamics.  Well-developed examples of this system occur in the Triassic basins.  The vegetation includes both non-forested bar and scour communities and the more extensive forested floodplain communities.  Forests are generally differentiated by depositional landforms such as levees, sloughs, ridges, terraces, and abandoned channel segments.  The system is affected by flooding through wetness, scouring,  deposition of material, and input of nutrients.

Variation:  Forested - Canopy forest present.

Other Variation(s):  Herbaceous.","."
232,"floodplain_forest",1,"CONUS",232,"01.C.3.D062M031E232",9841,"Southern Piedmont Small Floodplain and Riparian Forest","This system consists of vegetated communities along streams and small rivers in the Piedmont of the southeastern United States where flooding and flood-related environmental factors affect vegetation composition and dynamics. The vegetation includes both non-forested bar and scour communities and the more extensive forested floodplain communities. The forests of these smaller floodplains and bottomlands are not differentiated by depositional landforms such as levees, sloughs, ridges, terraces, and abandoned channel segments, because these features are small and flooding regimes are variable. The system is affected by flooding through wetness, scouring, deposition of material, and input of nutrients.","."
233,"floodplain_forest",1,"CONUS",233,"01.C.3.D062M031E233",9840,"West Gulf Coastal Plain Large River Floodplain Forest","This system represents a geographic subset of Kuchler's (1964) Southern Floodplain Forest found west of the Mississippi River. Examples may be found along large rivers of the West Gulf Coastal Plain and Upper West Gulf Coastal Plain, especially the Trinity, Neches, Sabine, and others. Several distinct plant communities can be recognized within this system that may be related to the array of different geomorphic features present within the floodplain. Some of the major geomorphic features associated with different community types include natural levees, point bars, meander scrolls, oxbows, and sloughs (Sharitz and Mitsch 1993). Vegetation generally includes forests dominated by bottomland hardwood species and other trees tolerant of flooding, including bald-cypress and water tupelo. However, herbaceous and shrub vegetation may be present in certain areas as well.","."
234,"floodplain_forest",1,"CONUS",234,"01.C.3.D062M031E234",9237,"West Gulf Coastal Plain Near-Coast Large River Swamp","These swamp forests are found along rivers flowing through the Gulf Coast Prairies and Marshes region of the Outer Coastal Plain of western Louisiana and adjacent Texas. Included are areas where the rivers enter bays and estuaries along the northern Gulf of Mexico that are somewhat tidally influenced.","."
235,"floodplain_forest",1,"CONUS",235,"01.C.3.D062M031E235",9839,"West Gulf Coastal Plain Small Stream and River Forest","This is a predominantly forested system of the West Gulf Coastal Plain associated with small rivers and creeks. In contrast to ~West Gulf Coastal Plain Large River Floodplain Forest (CES203.488)$$, examples of this system have fewer major geomorphic floodplain features. Those features that are present tend to be smaller and more closely intermixed with one another, resulting in less obvious vegetational zonation. Bottomland hardwood tree species are typically important and diagnostic, although mesic hardwood species are also present in areas with less inundation, such as upper terraces and possibly second bottoms. As a whole, flooding occurs annually, but the water table usually is well below the soil surface throughout most of the growing season. Areas impacted by beaver impoundments are also included in this system.","."
253,"floodplain_forest",1,"CONUS",253,"01.C.3.D062M154E253",9829,"Edwards Plateau Riparian","This system occurs in various situations along small and intermittent streams of the Edwards Plateau, with drier representatives occurring in the western plateau and the Stockton Plateau, and moister representatives (such as communities dominated by little walnut and splitleaf brickelbush) in the eastern plateau. Representatives of this system typically occur in stream-scoured situations and vary in the openness of the habitat and physiognomy.","."
270,"floodplain_forest",1,"CONUS",270,"01.C.3.D012M034E270",9825,"Rocky Mountain Lower Montane Riparian Woodland and Shrubland","These are stream side woodlands and shrublands at lower elevations in the Rocky Mountains.  This lush vegetation occurs on stream banks, adjacent floodplains, and can occur on in-stream islands, and sand or cobble bars.  It can form large, wide occurrences along larger rivers or narrow bands on small, rocky canyon tributaries and well-drained benches. It is also typically found in backwater channels and other perennially wet but less scoured sites, such as floodplains swales and irrigation ditches.  Hardwood trees and tall shrubs (cottonwood, maple, alder, western birch, creek dogwood and willow species), conifers (Douglas-fir, spruce or Ponderosa pine) dominate most sites, with a diverse understory of low shrubs (rose, snowberry), wildflowers and grasses.","."
271,"floodplain_forest",1,"CONUS",271,"01.C.3.D012M034E271",9813,"Rocky Mountain Montane Riparian Systems","This lower montane riparian systems group is found throughout the Rocky Mountains and Colorado Plateau regions within a broad elevational range from approximately 900 to 2800 m. These systems often occur as mosaics of multiple communities that are tree-dominated with a diverse shrub component. Occurrences are found within the flood zone of rivers, on islands, sand or cobble bars, and immediate streambanks. They can form large, wide occurrences on mid-channel islands in larger rivers or narrow bands on small, rocky canyon tributaries and well-drained benches. Stands are also found in backwater channels and other perennially wet but less scoured sites, such as floodplains swales and irrigation ditches. Dominant trees may include Acer negundo, Populus angustifolia, Populus balsamifera, Populus deltoides, Populus fremontii, Pseudotsuga menziesii, Picea pungens, Populus tremuloides, Salix amygdaloides, Juniperus scopulorum, Picea mariana, and Picea glauca. Dominant shrubs include Acer glabrum, Alnus incana, Betula occidentalis, Betula papyrifera, Cornus sericea, Crataegus rivularis, Forestiera pubescens, Prunus virginiana, Rhus trilobata, Salix monticola, Salix drummondiana, Salix exigua, Salix irrorata, Salix lucida, Shepherdia argentea, or Symphoricarpos spp. Exotic trees Elaeagnus angustifolia and Tamarix spp. are common in some stands.","."
280,"floodplain_forest",1,"CONUS",280,"01.C.3.D013M036E280",9833,"North American Warm Desert Lower Montane Riparian Woodland and Shrubland","These are riparian woodlands and shrublands found in the foothills and mountain canyons and valleys of southern Arizona, New Mexico, and adjacent Mexico. They are usually narrow wet habitats along the streams, with a patchy mosaic of open woodlands or forests, willows, rushes, sedges, and moist herbs and grasses. Common trees include narrowleaf cottonwood, Rio Grande cottonwood, Fremont cottonwood, Arizona sycamore, Arizona walnut, velvet ash, and wingleaf soapberry. Coyote willow, plum spp., Arizona alder, and mulefat are common shrubs. Vegetation is dependent upon annual or periodic flooding and associated sediment scour and/or annual rise in the water table for growth and reproduction.","."
